{"authority":{"allowed_network_hosts":[],"allowed_programs":[],"allowed_roots":["/tmp/ao-next-stage1-journal-prefix"],"capabilities":["read_workspace"],"expires_at":"2026-08-26T00:00:00Z","external_effects":"denied","issued_at":"2026-08-25T00:00:00Z","issued_by":"operator","network":"denied","schema_version":"ao.next.authority-envelope.v1"},"limits":{"max_effect_timeout_ms":120000,"max_input_bytes":1048576,"max_output_bytes":1048576,"max_repair_attempts":2,"max_run_ms":900000,"max_tokens":200000,"max_turns":8},"model_profile":{"adapter_version":"scripted-v1","context_limit":32000,"model_identifier":"fixture-model","output_limit":4000,"reasoning_effort":"high","runtime":"scripted","system_prompt_digest":"sha256:0000000000000000000000000000000000000000000000000000000000000000","tool_contract_digest":"sha256:1111111111111111111111111111111111111111111111111111111111111111"},"objective":"Export one strict immutable execution journal prefix","policy_digest":"sha256:0000000000000000000000000000000000000000000000000000000000000000","run_id":"run-stage1-export","schema_version":"ao.next.run-request.v1","source":{"head":"sha256:0000000000000000000000000000000000000000000000000000000000000000","repository":"local-fixture"},"verifier_profile":{"commands":[{"args":["test","--workspace"],"program":"cargo","timeout_ms":120000}],"profile_digest":"sha256:1111111111111111111111111111111111111111111111111111111111111111","profile_id":"fixture-verifier","required_artifacts":[]},"workspace":{"root":"/tmp/ao-next-stage1-journal-prefix","seed_digest":"sha256:1111111111111111111111111111111111111111111111111111111111111111","workspace_id":"workspace-stage1-export"}}
